latitude,longitude,name,listing_url
37.78701558,-122.40866,Dorm Room Private Bathroom F09,https://www.airbnb.com/rooms/16051031
37.78892949,-122.4121048,Beautiful room in SF Downtown,https://www.airbnb.com/rooms/8240011
37.78858828,-122.4154966,Nob Hill Home Away from Home.,https://www.airbnb.com/rooms/16497498
37.78789488,-122.4217148,Gorgeous Apt Centrally Located in Lower Nob Hill,https://www.airbnb.com/rooms/16710495
37.78806775,-122.4134898,Wyndham Canterbury Ü€‹ 1BR Equipped Condo,https://www.airbnb.com/rooms/15579683
37.78835532,-122.4091569,SF Hotel Studio: Union Square (1),https://www.airbnb.com/rooms/6453774
37.78819251,-122.4094991,Central Union Sq. Hotel/TS Studio,https://www.airbnb.com/rooms/8993301
37.78699137,-122.4097116,Central SF USq Hotel Timeshare,https://www.airbnb.com/rooms/8993293
37.78726597,-122.410619,Central Union Sq Nob Hill Studio,https://www.airbnb.com/rooms/8993289
37.78811601,-122.4168126,Shared Bedroom in Nob Hill,https://www.airbnb.com/rooms/17693146
37.78770164,-122.4131159,Pack - travel - sleep - repeat,https://www.airbnb.com/rooms/15972802
37.78682536,-122.4081317,BUNKHOUSE QUEEN A02,https://www.airbnb.com/rooms/6764986
37.78523236,-122.4128261,Private Room with shared bathroom in Hotel,https://www.airbnb.com/rooms/15990429
37.78093071,-122.4200707,Civic Center Studio With Parking,https://www.airbnb.com/rooms/2111361
37.78805185,-122.4111458,Central Studio Hotel/Timeshare USq,https://www.airbnb.com/rooms/9173711
37.78447803,-122.415099,Explore from Heart of San Francisco,https://www.airbnb.com/rooms/15792011
37.79003235,-122.4092011,Golden Gate Hotel,https://www.airbnb.com/rooms/17495801
37.77896844,-122.4193016,30 Day Minimum Rental,https://www.airbnb.com/rooms/571115
37.78563981,-122.4084231,Dorm Room with Hallway Bath D7,https://www.airbnb.com/rooms/17041687
37.77722393,-122.4229844,Luxury Bedroom with Private Bath,https://www.airbnb.com/rooms/10435334
37.78718413,-122.4129399,Private Room Ensuite 2 City Center,https://www.airbnb.com/rooms/11123431
37.78864822,-122.4112776,Private Room Ensuite 1 City Center,https://www.airbnb.com/rooms/11090058
37.78843063,-122.4070188,420 - Clean Hotel Room in PERFECT LOCATION,https://www.airbnb.com/rooms/16426353
37.78849546,-122.4123892,1bdrm Condo*SPECIAL PRICE TODAY*Wyndham Canterbury,https://www.airbnb.com/rooms/15325682
37.78696648,-122.4096087,Central USq Timeshare/Hotel Studio,https://www.airbnb.com/rooms/9156193
37.78790799,-122.4165039,Bright Urban Studio,https://www.airbnb.com/rooms/79420
37.78552979,-122.4201104,Luxury in the heart of the city,https://www.airbnb.com/rooms/8287787
37.78941582,-122.4125778,Private Room Ensuite 3 City Center,https://www.airbnb.com/rooms/11105741
37.78761213,-122.4083097,BUNKHOUSE QUAD C20,https://www.airbnb.com/rooms/14709338
37.78720485,-122.4161402,"Quiet, cozy, artist's studio in central location!",https://www.airbnb.com/rooms/14472082
37.78863867,-122.4123379,Swanky Accomodations for Super Bowl,https://www.airbnb.com/rooms/11023714
37.7883736,-122.4138049,Downtown San Francisco,https://www.airbnb.com/rooms/17283877
37.78500489,-122.4127325,Garland Weekly Special - SF Downtown/Union Square,https://www.airbnb.com/rooms/17866378
37.77725339,-122.4181188,Great city view private living room best location,https://www.airbnb.com/rooms/13823979
37.7877445,-122.4143478,HOUSE BY UNION SQUARE/MOSCONE CENTE,https://www.airbnb.com/rooms/472065
37.78728162,-122.411473,Studio at Donatello Hotel near Union Square (3),https://www.airbnb.com/rooms/13284332
37.78739507,-122.408454,BUNKHOUSE QUEEN A22,https://www.airbnb.com/rooms/12111841
37.7776902,-122.4225517,Private Room in Spacious Hayes Apt,https://www.airbnb.com/rooms/10912527
37.78828427,-122.4174649,Sunny Studio in Nob Hill,https://www.airbnb.com/rooms/13343019
37.78731093,-122.409033,BUNKHOUSE QUEEN  E23,https://www.airbnb.com/rooms/17826181
37.77782746,-122.4223259,Amazing condo in hip Hayes Valley,https://www.airbnb.com/rooms/8392607
37.78500286,-122.4162015,"Clean, Small Private Space to sleep in Downtown",https://www.airbnb.com/rooms/12405624
37.78736216,-122.4092255,BUNKHOUSE QUEEN B08,https://www.airbnb.com/rooms/12780009
37.78581796,-122.4148851,Cozy Mini Studio Apartment close to Union Square,https://www.airbnb.com/rooms/16157577
37.78654192,-122.4146897,Single Room with Private Bath,https://www.airbnb.com/rooms/17211646
37.78553624,-122.4078115,BUNKHOUSE QUEEN C15,https://www.airbnb.com/rooms/16944449
37.77768273,-122.4208402,Hayes Valley Hideaway,https://www.airbnb.com/rooms/14012294
37.78595987,-122.4141582,Room with 2 single beds & shared bathroom in Hotel,https://www.airbnb.com/rooms/17387395
37.7879507,-122.4140248,Spacious 1 BD apartment near Union Square,https://www.airbnb.com/rooms/17993571
37.78395412,-122.4153289,"Private Room/Shared Bathrooms, Room#15 (2 Guests)",https://www.airbnb.com/rooms/16664786
37.78918162,-122.4153664,Spacious Studio in the center of SF,https://www.airbnb.com/rooms/8558285
37.78390503,-122.4119145,Newly Renovated Designer Loft,https://www.airbnb.com/rooms/12505522
37.78521522,-122.4075859,Dorm Room with Hallway Bath D11,https://www.airbnb.com/rooms/17042239
37.78637067,-122.4128229,Private Room with shared bathroom in Hotel,https://www.airbnb.com/rooms/17864659
37.78724584,-122.4183162,Modern apartment in Nob Hill,https://www.airbnb.com/rooms/8288294
37.78927913,-122.4119197,Wyndham Canterbury - 2 Bdrm Presidential Suite,https://www.airbnb.com/rooms/17043285
37.785483,-122.4125526,Large 1 Bedroom 4 Blocks from Union Square by MUNI,https://www.airbnb.com/rooms/16310925
37.78923898,-122.4117081,Wyndham Canterbury 1 BR Presidential Reserve (1),https://www.airbnb.com/rooms/13913910
37.7869127,-122.4116917,Residential hotel Union Square SF,https://www.airbnb.com/rooms/17420087
37.78269777,-122.4166354,"Private Room/Shared Bathrooms, Room#5 (2 Guests)",https://www.airbnb.com/rooms/16548752
37.78048313,-122.4214511,Centrally Located One Bedroom,https://www.airbnb.com/rooms/8539905
37.78786852,-122.4170699,Cozy Modern Studio in Low Nob Hill,https://www.airbnb.com/rooms/10636038
37.78723292,-122.4166557,Cozy Studio in the heart of SF,https://www.airbnb.com/rooms/6459085
37.7849738,-122.4137167,Wonderful Studio In Downtown SF!NEW,https://www.airbnb.com/rooms/18008828
37.78713357,-122.4156202,Affordable twin bed at downtown,https://www.airbnb.com/rooms/17926899
37.78368965,-122.4166889,"Private Room/Shared Bathrooms, Room#10 (2 Guests)",https://www.airbnb.com/rooms/16549438
37.7854648,-122.4085031,BUNKHOUSE ECONOMY QUEEN HALL BATH A6,https://www.airbnb.com/rooms/8685898
37.78596965,-122.4155324,Private Room Near Downtown SF (11),https://www.airbnb.com/rooms/9533017
37.77805657,-122.416507,San Francisco 20 floors above Hayes,https://www.airbnb.com/rooms/10355311
37.78624496,-122.4130455,Garland at San Francisco Downtown/Union Square,https://www.airbnb.com/rooms/17714457
37.78494966,-122.4198475,private room near Japan town,https://www.airbnb.com/rooms/17594994
37.78775604,-122.4097853,Wonderful SF Timeshare/Hotel,https://www.airbnb.com/rooms/1624068
37.78586348,-122.4080468,BUNKHOUSE QUEEN A17,https://www.airbnb.com/rooms/8685570
37.77975769,-122.4147701,Music lover's dream loft w/ roof!,https://www.airbnb.com/rooms/3105383
37.78898893,-122.4107221,True San Francisco 2 Bedroom Apartm,https://www.airbnb.com/rooms/10342010
37.78533431,-122.4148427,1 Bedroom near Union Square,https://www.airbnb.com/rooms/15142505
37.77906691,-122.4147963,Test Room for Rent,https://www.airbnb.com/rooms/10702945
37.78726449,-122.4095478,BUNKHOUSE QUEEN A23,https://www.airbnb.com/rooms/12111957
37.77799506,-122.4227099,"Inn at the Opera ""Concerto Suite""",https://www.airbnb.com/rooms/9275385
37.78406104,-122.4166381,"Private Room/Shared Bathrooms, Room#11 (2 Guests)",https://www.airbnb.com/rooms/16664561
37.78575999,-122.4148914,Spacious Room Near Union Square (7),https://www.airbnb.com/rooms/4902907
37.78914611,-122.4096178,Large Timeshare/Hotel Rm (Union Sq),https://www.airbnb.com/rooms/1629740
37.7868168,-122.4092466,BUNKHOUSE QUEEN B15,https://www.airbnb.com/rooms/4638678
37.78883521,-122.4114015,Fully equipped studio,https://www.airbnb.com/rooms/10522671
37.78303237,-122.4154104,"Private Bathroom and Bath, Room#1 (2 Guests)",https://www.airbnb.com/rooms/16533022
37.78991943,-122.408328,Cozy Studio - Walk to Union Square,https://www.airbnb.com/rooms/6656023
37.78892231,-122.4092484,"San Francisco, The Donatello Studio",https://www.airbnb.com/rooms/1510980
37.78652735,-122.4138022,Garland at SF Downtown,https://www.airbnb.com/rooms/4900829
37.78004736,-122.4168977,Abigail at Civic Center,https://www.airbnb.com/rooms/3712146
37.78827423,-122.415058,Classic Private Room in Heart of SF,https://www.airbnb.com/rooms/5904304
37.78742576,-122.4215036,Central Dorm Queen Bedroom!,https://www.airbnb.com/rooms/8390615
37.78576816,-122.4188006,Renovated Studio in the Tendernob,https://www.airbnb.com/rooms/12652074
37.78730412,-122.418523,Cozy room in Nob Hill,https://www.airbnb.com/rooms/16158244
37.78381194,-122.4166175,"Private Room/Shared Bathrooms, Room#12 (2 Guests)",https://www.airbnb.com/rooms/16664636
37.78866386,-122.4123188,Residential hotel Union Square SF,https://www.airbnb.com/rooms/17419803
37.78764397,-122.4170455,Studio with Private Rooftop Garden,https://www.airbnb.com/rooms/5934599
37.78950315,-122.4124901,Wyndham Canterbury 2 Bedroom Deluxe (1),https://www.airbnb.com/rooms/13978543
37.78529008,-122.4089847,Dorm Bunk Private Bathroom E6,https://www.airbnb.com/rooms/17794730
37.78697396,-122.4090636,BUNKHOUSE QUEEN  D22,https://www.airbnb.com/rooms/17826075
37.78646431,-122.4071509,Dorm Bunk Private Bathroom E4,https://www.airbnb.com/rooms/17794706
37.77430721,-122.4216931,HEART of San Francisco!,https://www.airbnb.com/rooms/10767861
37.78801,-122.4193311,King Bed & Private Room in Downtown,https://www.airbnb.com/rooms/8524509
37.78322891,-122.4171417,"Charming, Light-Filled Apartment",https://www.airbnb.com/rooms/14961873
37.77805341,-122.4213035,Inn at the Opera - 1 night only,https://www.airbnb.com/rooms/9919519
37.78729382,-122.4094366,Cool Timeshare/Hotel (Union Sq.),https://www.airbnb.com/rooms/1281167
37.78982336,-122.4111376,Union Square Luxury Suite 201,https://www.airbnb.com/rooms/3689632
37.77903415,-122.4171394,Great City view master king bedroom private bathrm,https://www.airbnb.com/rooms/14027924
37.78816247,-122.4164101,Nice and clean apt downtown SF,https://www.airbnb.com/rooms/9586291
37.78700729,-122.4092411,BUNKHOUSE QUEEN C22,https://www.airbnb.com/rooms/14552166
37.78962238,-122.413076,Super Bowl Condo at Union Square!,https://www.airbnb.com/rooms/11077219
37.78843441,-122.4128015,Studio in downtown,https://www.airbnb.com/rooms/7785565
37.78478724,-122.4200108,1 bdrm apt with city views,https://www.airbnb.com/rooms/1772611
37.78713135,-122.4116986,Residential hotel close to Union Square in DWTN SF,https://www.airbnb.com/rooms/17419327
37.78484809,-122.412703,"This is a test listing, don't book.",https://www.airbnb.com/rooms/5403210
37.78731092,-122.4142841,Sunny & Recently Renovated,https://www.airbnb.com/rooms/12382342
37.78573193,-122.4093508,Entire Place in Downtown San Fran,https://www.airbnb.com/rooms/9908325
37.78436805,-122.4153644,"Private Bathroom and Bath, Room#3 (2 Guests)",https://www.airbnb.com/rooms/16543792
37.78935499,-122.408833,Superbowl City Apartment - 1 BR,https://www.airbnb.com/rooms/7024670
37.78744937,-122.4092552,BUNKHOUSE QUEEN B12,https://www.airbnb.com/rooms/12511225
37.78718366,-122.4093882,BUNKHOUSE QUEEN A01,https://www.airbnb.com/rooms/6762434
37.78336444,-122.4209233,1 Master Bedroom En-suite & Parking,https://www.airbnb.com/rooms/3469254
37.78912723,-122.4105967,Private Room Ensuite 5 City Center,https://www.airbnb.com/rooms/13021103
37.77959524,-122.4231628,Inn at the Opera- Studio,https://www.airbnb.com/rooms/16461727
37.78872806,-122.413782,San Francisco 1br Near Union Square,https://www.airbnb.com/rooms/11497800
37.78846489,-122.4095917,Downtown Top U. Sq. Hotel/TS Studio,https://www.airbnb.com/rooms/7958349
37.78876002,-122.4116199,Wyndham Canterbury 1 Bedroom Deluxe (2),https://www.airbnb.com/rooms/5173043
37.78769849,-122.4099117,Downtown Timeshare/Hotel Studio USq,https://www.airbnb.com/rooms/7958316
37.78896614,-122.4141055,Adorable studio close to all,https://www.airbnb.com/rooms/8597259
37.78189781,-122.4149473,McAllister Tower,https://www.airbnb.com/rooms/9645663
37.7874295,-122.4093167,Room at Hotel Donatello,https://www.airbnb.com/rooms/11021886
37.78930059,-122.413044,Wyndham Canterbury 1 Bedroom Deluxe (3),https://www.airbnb.com/rooms/11775546
37.77780726,-122.4187492,Modern Lofted Studio In SF Theater District,https://www.airbnb.com/rooms/17624633
37.78605371,-122.4095782,BUNKHOUSE QUEEN C17,https://www.airbnb.com/rooms/14963288
37.77854275,-122.4191774,Marina studio prime location,https://www.airbnb.com/rooms/10104291
37.78845706,-122.4111698,Downtown Hotel/TS Studio Union Sq,https://www.airbnb.com/rooms/8089051
37.78265101,-122.419356,Sunny Apartment! Great Amenities! Unbeatable Price,https://www.airbnb.com/rooms/17483684
37.78785931,-122.4144569,"Bright, simple downtown studio",https://www.airbnb.com/rooms/9531405
37.78831989,-122.4098202,Studio Suite at The Donatello Hotel,https://www.airbnb.com/rooms/7146663
37.78840769,-122.4160245,Bright studio in the heart of SF,https://www.airbnb.com/rooms/13528513
37.78876773,-122.4083022,1 Queen bedded room w/full bath,https://www.airbnb.com/rooms/10067187
37.78697352,-122.4142846,Breathtaking City Views!,https://www.airbnb.com/rooms/6958513
37.77653321,-122.4187758,"Modern 2Bd, 2Ba Downtown Apartment",https://www.airbnb.com/rooms/224671
37.78869223,-122.4130498,Wyndham Canterbury San Francisco Jul 2-5 2017 1-BR,https://www.airbnb.com/rooms/17591034
37.78810562,-122.4153729,The Sutter Residence,https://www.airbnb.com/rooms/16018565
37.78860987,-122.410737,Donatello Hotel 4 Dreamforce Oct3-8,https://www.airbnb.com/rooms/10792038
37.78469958,-122.4138893,Garland at San Francisco Downtown/Union Square #2,https://www.airbnb.com/rooms/17787995
37.78836168,-122.4106279,Downtown SF Large Hotel/TS Studio,https://www.airbnb.com/rooms/7958278
37.77981465,-122.4218951,Inn at the Opera Hotel Room,https://www.airbnb.com/rooms/9119249
37.78663806,-122.4094268,Downtown Spacious Hotel/TS Studio,https://www.airbnb.com/rooms/7958214
37.78363062,-122.4165129,"Private Room, Shared Bathroom, Room#1 (1 Guest)",https://www.airbnb.com/rooms/16549601
37.78871135,-122.4105685,The Donatello in Union Square,https://www.airbnb.com/rooms/12185282
37.78845994,-122.4125523,Amazing Sublet in the heart of SF!,https://www.airbnb.com/rooms/5750941
37.78733169,-122.4092491,Downtown USq Timeshare/Hotel Studio,https://www.airbnb.com/rooms/7958168
37.78397678,-122.4153238,"Private Room/Shared Bathrooms, Room#13 (2 Guests)",https://www.airbnb.com/rooms/16664687
37.78780147,-122.4097767,"DONATELLO Hotel room, Union Square ",https://www.airbnb.com/rooms/2279254
37.77537078,-122.4201404,Brand New Condo That Feels Like Home,https://www.airbnb.com/rooms/15821780
37.78383768,-122.4107756,Private Room on Turk ST,https://www.airbnb.com/rooms/4795339
37.78744874,-122.4080927,BUNKHOUSE QUEEN A09,https://www.airbnb.com/rooms/7367530
37.78281612,-122.4107919,Private Room on Youth Hostel,https://www.airbnb.com/rooms/4795263
37.78509915,-122.4123845,Modern Studio in Downtown SF,https://www.airbnb.com/rooms/469810
37.78688321,-122.4077741,BUNKHOUSE QUEEN B16,https://www.airbnb.com/rooms/4728615
37.78860622,-122.4132962,San Francisco Condo - Wyndham Canterbury,https://www.airbnb.com/rooms/16771827
37.78221494,-122.4228937,"Bright, Large Studio in the Heart of SF",https://www.airbnb.com/rooms/12592006
37.78867009,-122.4156603,Studio in Nob Hill,https://www.airbnb.com/rooms/10857835
37.78525874,-122.4196921,Stay in the heart of San Francisco,https://www.airbnb.com/rooms/224590
37.78707009,-122.4119705,Urban Artsy Studio in prime Nob Hill,https://www.airbnb.com/rooms/9841955
37.78677205,-122.4074929,Dorm Room with Hallway Bathroom E14,https://www.airbnb.com/rooms/17794830
37.78796663,-122.4150675,The HEART of SF - Central Location,https://www.airbnb.com/rooms/1551553
37.77660888,-122.4177347,Beautiful Studio on 17th St,https://www.airbnb.com/rooms/7620288
37.78309705,-122.4164612,"Private Room/Shared Bathrooms, Room#8 (2 Guests)",https://www.airbnb.com/rooms/16549244
37.787491,-122.4139135,Union Square Studio,https://www.airbnb.com/rooms/3779249
37.77482226,-122.4214163,Hayes Valley Luxury Condo,https://www.airbnb.com/rooms/2172695
37.78818884,-122.4134272,"Posh Downtown Studio, Steps From Union Square",https://www.airbnb.com/rooms/15583984
37.7857389,-122.4079771,Union Square Modern Loft,https://www.airbnb.com/rooms/10832
37.78536234,-122.4077592,BUNKHOUSE QUEEN ECONOMY HALL BATH A7,https://www.airbnb.com/rooms/8685943
37.77731639,-122.419116,Modern Apartment Next to Uber/Square/Twitter,https://www.airbnb.com/rooms/15624763
37.78587775,-122.4162135,Summer room,https://www.airbnb.com/rooms/13657857
37.77948777,-122.4225563,San Francisco New Year 2017 Eve countdown 3 nights,https://www.airbnb.com/rooms/15042300
37.78719571,-122.4081145,BUNKHOUSE ECONOMY QUEEN HALL BATH A3,https://www.airbnb.com/rooms/8685766
37.78719777,-122.4094247,Super Bowl 50 week,https://www.airbnb.com/rooms/10546027
37.78703918,-122.4172841,NEW Studio Cozy Top Floor Center of the SF Action,https://www.airbnb.com/rooms/17191322
37.78831958,-122.4120734,Super Bowl Weekend Deal,https://www.airbnb.com/rooms/11086227
37.77931513,-122.4225263,SF Victorian-Inn at the Opera (1br),https://www.airbnb.com/rooms/12183939
37.78698231,-122.4091863,Central Dwntwn USq Studio Timeshare,https://www.airbnb.com/rooms/9316519
37.7883515,-122.4119012,Luxury 1BR Condo Near Union Square,https://www.airbnb.com/rooms/12363944
37.78267704,-122.4222033,The V - An elegant modern studio,https://www.airbnb.com/rooms/8489712
37.77763775,-122.4229465,Spacious apartment in Hayes Valley,https://www.airbnb.com/rooms/10823803
37.78529865,-122.4082313,BUNKHOUSE QUEEN B21,https://www.airbnb.com/rooms/5070957
37.78721527,-122.4155167,Studio near Union Square,https://www.airbnb.com/rooms/10857065
37.78728421,-122.407696,Dorm Bunk Private Bathroom E9,https://www.airbnb.com/rooms/17794741
37.7779462,-122.4217771,Live like a San Franciscan!,https://www.airbnb.com/rooms/1484792
37.78528565,-122.4155614,Single Bed with Shared Bath,https://www.airbnb.com/rooms/17516202
37.79014851,-122.4075296,Compact 1-Bedroom Unit in San Fran,https://www.airbnb.com/rooms/862203
37.78820116,-122.4146287,Central Location - Cozy Studio,https://www.airbnb.com/rooms/8540473
37.7870188,-122.4198057,Weekend getaway,https://www.airbnb.com/rooms/4040475
37.78626251,-122.408017,BUNKHOUSE QUEEN B11,https://www.airbnb.com/rooms/12510982
37.78878139,-122.4114781,Outstanding Hotel/TS (Union Square),https://www.airbnb.com/rooms/2943327
37.78838974,-122.4094458,Lovely Union Sq. Timeshare/Hotel,https://www.airbnb.com/rooms/2926901
37.78723981,-122.4093908,BUNKHOUSE ECONOMY QUEEN HALL BATH B03,https://www.airbnb.com/rooms/13560107
37.78781957,-122.4137364,Updated Condo in Wyndham Canterbury *Union Square*,https://www.airbnb.com/rooms/15214880
37.7871598,-122.4098349,DONATELLO near Moscone and Union Sq,https://www.airbnb.com/rooms/2468125
37.78483567,-122.419399,SF Entire Studio,https://www.airbnb.com/rooms/16230094
37.78721514,-122.4096927,"Donatello, King Size Bed, near Moscone",https://www.airbnb.com/rooms/13973341
37.78600527,-122.4082555,BUNKHOUSE QUEEN A14,https://www.airbnb.com/rooms/8565153
37.78846602,-122.4164714,Chrming Studio 4 blocks to Union Sq,https://www.airbnb.com/rooms/1905976
37.78918567,-122.4135415,3 BD Pres in San Francisco,https://www.airbnb.com/rooms/13018401
37.7900611,-122.4079039,Studio Timeshare - San Francisco #1,https://www.airbnb.com/rooms/862163
37.78800429,-122.4114577,Fantastic Hotel/TS (Union Square),https://www.airbnb.com/rooms/2959323
37.78263111,-122.4166116,Cozy Apartment in Civic Center,https://www.airbnb.com/rooms/9430983
37.78680319,-122.4077514,BUNKHOUSE QUEEN A11,https://www.airbnb.com/rooms/8554141
37.78433547,-122.416043,"Private Shower/Shared Bathroom, Room#1 (2 Guests)",https://www.airbnb.com/rooms/16545687
37.7860013,-122.4130507,Room with 2 single beds & shared bathroom in Hotel,https://www.airbnb.com/rooms/17385851
37.7773499,-122.4224388,Hayes Boutique Studio with Parking,https://www.airbnb.com/rooms/707236
37.78207905,-122.4217747,"Startup Basecamp,org The First Startup Hotel (#3)",https://www.airbnb.com/rooms/11461771
37.78722317,-122.4081722,BUNKHOUSE QUEEN B23,https://www.airbnb.com/rooms/5260816
37.7880679,-122.4185859,Super Bowl Special,https://www.airbnb.com/rooms/10937873
37.78750047,-122.4136974,Classic Nob Hill Studio,https://www.airbnb.com/rooms/7950510
37.7894649,-122.4129971,Wyndham Canterbury 1 Bedroom Deluxe (1),https://www.airbnb.com/rooms/11183089
37.77456667,-122.4213,Modern Apt in Hayes Valley (2BR),https://www.airbnb.com/rooms/10789800
37.7875227,-122.4095836,Studio at Donatello Hotel near Union Square (2),https://www.airbnb.com/rooms/13264364
37.78721493,-122.413163,Residential hotel close to Union Square in DWTN SF,https://www.airbnb.com/rooms/17016281
37.7884672,-122.4138802,Super Cozy Union Square Apartment,https://www.airbnb.com/rooms/4171151
37.78678225,-122.4202624,Bright and Spacious Apartment in the Centre,https://www.airbnb.com/rooms/15721864
37.78938021,-122.4081533,Ste 1408-1 Queen Bedrm & Living Rm,https://www.airbnb.com/rooms/10282371
37.78888883,-122.4090006,Ste 1502-1 Queen Bedrm & Living Rm,https://www.airbnb.com/rooms/10282326
37.79003758,-122.4092141,Four-Star Union Square Hotel,https://www.airbnb.com/rooms/2658295
37.78845769,-122.4106211,Downtown SF USq Hotel/TS Studio,https://www.airbnb.com/rooms/8084285
37.78170314,-122.4231243,Downtown San Francisco,https://www.airbnb.com/rooms/6416081
37.78639051,-122.4148032,Cute Studio Condo,https://www.airbnb.com/rooms/9216687
37.78758603,-122.4090527,Union Square Hotel/Timeshare Studio,https://www.airbnb.com/rooms/1614453
37.78941509,-122.4115858,Wyndham Canterbury at San Francisco,https://www.airbnb.com/rooms/14836328
37.78579067,-122.4162689,"Relaxing, warm place in the heart of San Francisco",https://www.airbnb.com/rooms/17556056
37.78746855,-122.4150482,Beautiful Private Room Downtown,https://www.airbnb.com/rooms/10888761
37.78839085,-122.4093714,Super Hotel/Timeshare Union Sq.,https://www.airbnb.com/rooms/1483853
37.78715483,-122.4119009,"Cute, sunny studio right downtown!",https://www.airbnb.com/rooms/910338
37.78845709,-122.4213429,Newly Remodeled Loft Lower Nob Hill,https://www.airbnb.com/rooms/1827911
37.78841412,-122.4145451,DOWNTOWN APARTMENT,https://www.airbnb.com/rooms/7005242
37.78784823,-122.4130918,Wyndham Canterbury 1 Bedroom Deluxe (8),https://www.airbnb.com/rooms/14197816
37.77692593,-122.4181918,Nice Room,https://www.airbnb.com/rooms/11731031
37.78449752,-122.4180384,Cozy chic studio in SF city center,https://www.airbnb.com/rooms/12263934
37.78997892,-122.4074824,Studio Condo - 2 Blocks from Union Square,https://www.airbnb.com/rooms/10068465
37.78133099,-122.4119049,Downtown Studio,https://www.airbnb.com/rooms/7638453
37.78537012,-122.407931,BUNKHOUSE ECONOMY QUEEN HALL BATH C03,https://www.airbnb.com/rooms/16944561
37.78725353,-122.409164,Dorm Bunk Private Bathroom F15,https://www.airbnb.com/rooms/17794453
37.78321788,-122.419635,Spacious Central and Modern Apt!,https://www.airbnb.com/rooms/9351225
37.78841007,-122.4124538,Wyndham Canterbury 1 Bedroom Deluxe (7),https://www.airbnb.com/rooms/14197078
37.78561729,-122.4074439,Premium Central Union Square Suite,https://www.airbnb.com/rooms/10805572
37.78834959,-122.4184844,Your Own SF Apt - Walker's Dream!,https://www.airbnb.com/rooms/10503631
37.7846841,-122.414812,Private Room Near Downtown SF (15),https://www.airbnb.com/rooms/4902729
37.78544483,-122.4150521,double Deluxe with shared bath,https://www.airbnb.com/rooms/17717979
37.78935037,-122.4134694,Last Minute Super Bowl 50!,https://www.airbnb.com/rooms/11079072
37.78729538,-122.4095765,BUNKHOUSE QUEEN B22,https://www.airbnb.com/rooms/5070973
37.78681039,-122.4092969,BUNKHOUSE QUEEN B20,https://www.airbnb.com/rooms/5070945
37.77613449,-122.4214272,asdf,https://www.airbnb.com/rooms/15998980
37.78664608,-122.4184259,"NEW: Clean, Cute & Bright Studio!",https://www.airbnb.com/rooms/16256406
37.78303855,-122.4192965,Private Bedroom and Bath,https://www.airbnb.com/rooms/8421068
37.78481926,-122.4195045,Clean and Spacious Room on Polk,https://www.airbnb.com/rooms/16286043
37.78747353,-122.4092647,DORM ROOM AT BUNKHOUSE 1,https://www.airbnb.com/rooms/14687667
37.78500244,-122.4190045,"Beautiful studio, great location!",https://www.airbnb.com/rooms/200580
37.77490505,-122.4207979,Location Location Location!,https://www.airbnb.com/rooms/11080673
37.78558426,-122.4094092,BUNKHOUSE QUEEN B18,https://www.airbnb.com/rooms/5070054
37.7843285,-122.411078,Bright downtown studio with queen bed,https://www.airbnb.com/rooms/13174268
37.78440067,-122.4147192,"Private Room/Shared Bathrooms, Room#2 (2 Guests)",https://www.airbnb.com/rooms/16548237
37.78884348,-122.4142996,Nob Hill Super Bowl Apartment,https://www.airbnb.com/rooms/10771698
37.78909156,-122.4099337,2 Twin beds with a full bath,https://www.airbnb.com/rooms/10099733
37.78711735,-122.41142,Four-star hotel (Club Donatello): April 4-6,https://www.airbnb.com/rooms/15620606
37.78700489,-122.4081005,DORM ROOM AT BUNKHOUSE 4,https://www.airbnb.com/rooms/17826575
37.78828147,-122.4146098,Spacious Bedroom,https://www.airbnb.com/rooms/10836945
