latitude,longitude,name,listing_url
37.75418395,-122.4065138,"Simple, new, clean accommodation",https://www.airbnb.com/rooms/10988680
37.75416621,-122.4215336,Spacious 2BR/2BATH w/Shared Kitchen,https://www.airbnb.com/rooms/8053481
37.75850584,-122.4061523,Private room - Victorian House in the Mission,https://www.airbnb.com/rooms/14011173
37.75654875,-122.4220251,Spacious 1BR in the Mission District,https://www.airbnb.com/rooms/16142131
37.76005055,-122.4213524,Edwardian flat in heart of Mission,https://www.airbnb.com/rooms/9080622
37.75949488,-122.4248737,Sunny Room w/Roofdeck @Dolores Park,https://www.airbnb.com/rooms/936209
37.76099687,-122.4131237,Boutique Condo in the Mission,https://www.airbnb.com/rooms/7048973
37.75054282,-122.4165585,Pretty & Relaxing Bedroom with Bathroom,https://www.airbnb.com/rooms/7998215
37.75628818,-122.4087377,Spacious Mission Condo,https://www.airbnb.com/rooms/12815115
37.75724642,-122.4093147,Bright Skylight-Filled 2 Bedroom in the Mission,https://www.airbnb.com/rooms/10406646
37.74932935,-122.4107925,Charming Mission Victorian 3bd/2ba,https://www.airbnb.com/rooms/4558566
37.7513531,-122.4176588,2B Central Mission District,https://www.airbnb.com/rooms/2771688
37.75199246,-122.4042105,Sunny garden room on 24th,https://www.airbnb.com/rooms/5020057
37.76142933,-122.4193501,"Live/Work Tech Space #1 - Mission, SF",https://www.airbnb.com/rooms/15151013
37.76652079,-122.4246601,Mission: Small Room in a Great Flat,https://www.airbnb.com/rooms/4925354
37.75995514,-122.4241064,Charming house in the Mission,https://www.airbnb.com/rooms/13863669
37.75870167,-122.42124,"Private Room, Large House Mission",https://www.airbnb.com/rooms/5394755
37.76147949,-122.4157135,Cozy & Central Mission Apt,https://www.airbnb.com/rooms/8861480
37.75939066,-122.4211674,Spacious Sun-Drenched Beauty Near Dolores Park,https://www.airbnb.com/rooms/14139656
37.74961782,-122.4181314,Cozy Bedroom in Mission District,https://www.airbnb.com/rooms/7802522
37.75958581,-122.4100011,1 BR Cottage Close to Mission Awesomeness,https://www.airbnb.com/rooms/15470227
37.75560551,-122.4067193,"Bright, spacious Mission flat",https://www.airbnb.com/rooms/10756717
37.7505213,-122.4073568,San Francisco Mission Hideout,https://www.airbnb.com/rooms/1117756
37.76832743,-122.4250571,Top Floor Mission Dolores Private Bedroom,https://www.airbnb.com/rooms/17588923
37.76888719,-122.4240599,Bright & Beautiful Apartment,https://www.airbnb.com/rooms/7228772
37.75134306,-122.4226501,Cozy and spacious room in a great location,https://www.airbnb.com/rooms/15501322
37.75506955,-122.4168171,"GorgeousVictorian Rm, TrendyMission",https://www.airbnb.com/rooms/4624467
37.7622065,-122.4198954,Mission Penthouse Master Suite,https://www.airbnb.com/rooms/856123
37.753852,-122.4111577,Fabulous Mission Apt. Very Private,https://www.airbnb.com/rooms/9490490
37.76251893,-122.4242846,"Huge Modern 2BR Apartment, Close to Everything",https://www.airbnb.com/rooms/865873
37.76531007,-122.4246905,Cute spot in the Mission,https://www.airbnb.com/rooms/6834158
37.76362666,-122.4253853,1BR Private Room in Spacious Victorian Home!,https://www.airbnb.com/rooms/13846498
37.7681406,-122.4253676,"2b/2b modern condo, super location",https://www.airbnb.com/rooms/1101403
37.75866765,-122.42388,Spacious Mission 1-BR,https://www.airbnb.com/rooms/15566812
37.76148205,-122.4092539,Beautiful one bedroom Retreat - Mission District,https://www.airbnb.com/rooms/16173016
37.75399609,-122.4177063,Private Studio in Mission,https://www.airbnb.com/rooms/63405
37.75328433,-122.4118579,Private room in beautiful Mission apartment,https://www.airbnb.com/rooms/16857004
37.75028261,-122.4156194,Superbowl Apt. near Frway and Bart!,https://www.airbnb.com/rooms/11011745
37.75813182,-122.4141177,Twin Beds in Prime Central Location,https://www.airbnb.com/rooms/17697262
37.75754497,-122.4201252,Mission Studio in the Perfect Location,https://www.airbnb.com/rooms/13043340
37.76249605,-122.422603,SF Mission Dolores Home,https://www.airbnb.com/rooms/2049672
37.7580424,-122.4211011,Private Room in Beautiful Apartment,https://www.airbnb.com/rooms/16272594
37.75788359,-122.4075305,Mission House w Roof Deck / Yard,https://www.airbnb.com/rooms/10947787
37.75456441,-122.4125264,Sweet Mission Room,https://www.airbnb.com/rooms/15873936
37.75239754,-122.4244804,Tiny Urban Cottage,https://www.airbnb.com/rooms/11259062
37.76911001,-122.4119345,Sunlit and modern apartment in SOMA,https://www.airbnb.com/rooms/7163038
37.76862344,-122.4244366,Comfortable Room in Artistic Condo,https://www.airbnb.com/rooms/4533440
37.76066203,-122.4208268,Bright studio in the HEART OF THE MISSION,https://www.airbnb.com/rooms/14011529
37.75826018,-122.4083304,WEEKEND ROOM IN THE MISSION ,https://www.airbnb.com/rooms/3379430
37.75596136,-122.4095302,"Clean, cozy, and spacious apartment",https://www.airbnb.com/rooms/8029798
37.75942336,-122.4075424,Private suite - in vibrant Mission,https://www.airbnb.com/rooms/1623609
37.75993231,-122.4213667,Heart of the Mission New Cozy Charmer,https://www.airbnb.com/rooms/16324639
37.77021195,-122.4228986,Quaint bedroom in the heart of SF,https://www.airbnb.com/rooms/17501306
37.75065685,-122.4234918,Big Victorian home in ä»« of Mission,https://www.airbnb.com/rooms/591431
37.74944922,-122.4095556,Your Bright & Spacious Mission home,https://www.airbnb.com/rooms/9351735
37.75375109,-122.4252011,Comfy & quiet. Awesome location,https://www.airbnb.com/rooms/1962559
37.75641542,-122.4128513,Victorian in the heart of Mission,https://www.airbnb.com/rooms/6926901
37.76772249,-122.422152,Spacious & sunny 1br apartment,https://www.airbnb.com/rooms/12366392
37.75151485,-122.4245018,Noe Valley/Mission Studio,https://www.airbnb.com/rooms/5943416
37.75440053,-122.412507,Heart of the Mission!,https://www.airbnb.com/rooms/1339473
37.75309747,-122.4199679,Room in Valencia Flat,https://www.airbnb.com/rooms/10940485
37.75780405,-122.4214434,Sunny & Modern Mission Gem,https://www.airbnb.com/rooms/10792779
37.74970235,-122.4066375,A Sunshine Lit Double Suite,https://www.airbnb.com/rooms/5414237
37.76645745,-122.4253543,Beautiful Room w/ Bay Window in the Mission!,https://www.airbnb.com/rooms/6954332
37.75089762,-122.4148136,Nice Mission Apartment Walk to BART,https://www.airbnb.com/rooms/10809367
37.75110865,-122.4187323,Cozy studio in the Mission,https://www.airbnb.com/rooms/815123
37.75526258,-122.4249664,Mission Dolores Noe Valley Studio,https://www.airbnb.com/rooms/1388523
37.75691789,-122.4111644,"Gorgeous Mission Loft, Great Light!",https://www.airbnb.com/rooms/765914
37.76096715,-122.4231305,Private Mission Room Near Valencia,https://www.airbnb.com/rooms/225205
37.75849371,-122.4157999,Sunny two-bedroom in vibrant Mission District,https://www.airbnb.com/rooms/6795192
37.74825404,-122.4176816,Modern Mission Apt. w/ Private Bath,https://www.airbnb.com/rooms/5775177
37.75267808,-122.4075329,2-Room Suite in Vibrant Mission,https://www.airbnb.com/rooms/8907289
37.76455721,-122.4239801,Large 1bd condo in Mission Dolores!,https://www.airbnb.com/rooms/13953008
37.751588,-122.4187695,Cozy Mission apt,https://www.airbnb.com/rooms/16232349
37.75618418,-122.421447,cozy apartment in the Mission,https://www.airbnb.com/rooms/8384398
37.7569887,-122.4085638,Sunny condo - Mission District,https://www.airbnb.com/rooms/223213
37.76313587,-122.4079654,Private BDRM/BA in trendy SF Apt w/360 views!,https://www.airbnb.com/rooms/16363397
37.74907405,-122.4124016,"large, comfy br in fun neighborhood",https://www.airbnb.com/rooms/5468024
37.75083547,-122.4234114,Private Garden Room in Victorian Home!,https://www.airbnb.com/rooms/1356129
37.75857822,-122.4222351,Sunny Modern Mission Dolores Condo,https://www.airbnb.com/rooms/10710892
37.75913346,-122.4196755,"Private, Quiet Apartment in Heart of the Mission",https://www.airbnb.com/rooms/16178751
37.75746793,-122.4125947,Room in a lovely flat,https://www.airbnb.com/rooms/15097007
37.76171887,-122.4234831,Queen bedroom in gorgeous bright Dolores luxury,https://www.airbnb.com/rooms/16351934
37.76867194,-122.4178576,Comfy Classic Victorian - 2 BR,https://www.airbnb.com/rooms/8564563
37.76379548,-122.425448,Spacious 1 BDR apt by Dolores Park,https://www.airbnb.com/rooms/6852699
37.77017333,-122.4215716,Edwardian Condo Centrally Located,https://www.airbnb.com/rooms/6336315
37.76025251,-122.4166307,Clean and Modern Mission Cottage,https://www.airbnb.com/rooms/2074584
37.75104087,-122.4186658,Beautiful Mission Victorian Home,https://www.airbnb.com/rooms/765739
37.76764528,-122.4239505,Private room in top Edwardian Flat,https://www.airbnb.com/rooms/9525911
37.75122694,-122.4183758,Heart of Mission District - Queen,https://www.airbnb.com/rooms/11650390
37.76667538,-122.4170325,Luxury Streetside Apt Near Public Transportation,https://www.airbnb.com/rooms/14773204
37.76054446,-122.421676,Small Room steps from Valencia,https://www.airbnb.com/rooms/5470034
37.75110161,-122.4241432,Modern luxury; Noe Valley pvt flat,https://www.airbnb.com/rooms/1814061
37.76045876,-122.4190438,Charming Private Studio in Mission,https://www.airbnb.com/rooms/2046807
37.75311615,-122.4086315,Large room in Slick Victorian ,https://www.airbnb.com/rooms/486950
37.75731078,-122.4095373,BEDROOM-f (July 31--->),https://www.airbnb.com/rooms/592883
37.75174324,-122.4162526,Mission District Artsy 1 BDRM,https://www.airbnb.com/rooms/9350676
37.76777714,-122.4243382,Mission/Castro one-bedroom suite,https://www.airbnb.com/rooms/1093088
37.76121341,-122.4086907,Bright Basement Apartment UNFURNISHED,https://www.airbnb.com/rooms/13725185
37.75297177,-122.4128058,Sunny Mission 2BD - Victorian house,https://www.airbnb.com/rooms/2502127
37.75833813,-122.4229128,1-Br Mission (Near Dolores Park) - Holidays,https://www.airbnb.com/rooms/16231927
37.76040329,-122.415501,Cozy Full Apart with parking,https://www.airbnb.com/rooms/2043364
37.75753955,-122.4106128,SUNNY ROOM/PRIVATE BATH/LIVINGROOM!,https://www.airbnb.com/rooms/2010572
37.75271742,-122.4093401,Private Garden Artist Space,https://www.airbnb.com/rooms/176092
37.76059363,-122.4185532,Lovely Place!,https://www.airbnb.com/rooms/5107706
37.74851144,-122.4172331,Spacious room near Valencia St,https://www.airbnb.com/rooms/10153977
37.75842278,-122.4119598,"Sunny&Quiet 2BDR loft, Top location",https://www.airbnb.com/rooms/8105974
37.75996482,-122.4179394,Great room in the heart of Mission,https://www.airbnb.com/rooms/6974923
37.76403193,-122.4248225,Private room in heart of Mission,https://www.airbnb.com/rooms/9219530
37.74964663,-122.4175526,2 Lofted Beds in Community House!,https://www.airbnb.com/rooms/9884258
37.76945631,-122.4227033,Chic Sunny Mission Apartment,https://www.airbnb.com/rooms/7400895
37.7682995,-122.4253431,3 bedroom w Garden - Luxury Mission,https://www.airbnb.com/rooms/9448855
37.7644722,-122.418478,Private Bedroom in Mission,https://www.airbnb.com/rooms/7974287
37.76896906,-122.4108756,Modern Private Room with Bath,https://www.airbnb.com/rooms/13622506
37.7594018,-122.4181344,Beautiful and spacious house in the Mission,https://www.airbnb.com/rooms/17316289
37.75991582,-122.4191283,Charming Apartment in the Mission District,https://www.airbnb.com/rooms/58756
37.75446376,-122.4224758,"Cozy Room for One or Two, Great Neighborhood",https://www.airbnb.com/rooms/1892956
37.74984557,-122.4239428,Classic SF Victorian in Noe/Mission,https://www.airbnb.com/rooms/8973469
37.7614406,-122.4213018,Stay in the heart of The Mission,https://www.airbnb.com/rooms/15150231
37.75327879,-122.4118102,Cozy private bedroom in the Mission District,https://www.airbnb.com/rooms/3695452
37.75017197,-122.41734,Cozy room in the Mission,https://www.airbnb.com/rooms/9481209
37.74936883,-122.4223664,Private Room in Valencia Corridor (Mission),https://www.airbnb.com/rooms/13085830
37.7660067,-122.4183305,Cozy place near by Mission dolores ,https://www.airbnb.com/rooms/1403992
37.74866918,-122.4213935,Exquisite top-floor flat in Mission,https://www.airbnb.com/rooms/3419211
37.76864954,-122.42457,Mission/Castro Home Sweet SF Home!,https://www.airbnb.com/rooms/273452
37.76601194,-122.4229685,Bedroom in the Heart of the Mission,https://www.airbnb.com/rooms/5008402
37.75845746,-122.4086654,Sunny and Spacious Two Bdrm in 1895 Victorian Home,https://www.airbnb.com/rooms/10586068
37.757922,-122.4141182,Charming Victorian in the heart of the Mission,https://www.airbnb.com/rooms/13802791
37.75877365,-122.4108145,Private Bed & Bath in heart of SF,https://www.airbnb.com/rooms/8213336
37.74979106,-122.4087655,Private Room in San Francisco's Mission District,https://www.airbnb.com/rooms/2502368
37.76573017,-122.4209976,Nice Apartment right in Mission,https://www.airbnb.com/rooms/7492644
37.76058002,-122.4254066,"Modern, Spacious, Prime Location äÖ€",https://www.airbnb.com/rooms/3079665
37.7673056,-122.4254201,Private bath/Queen bdrm/Super Location,https://www.airbnb.com/rooms/470686
37.75884751,-122.4059452,Private Room - in Mission House,https://www.airbnb.com/rooms/3194136
37.76845419,-122.4216172,private room 12x10 ft heart of valencia st sf,https://www.airbnb.com/rooms/12906085
37.75696962,-122.4076487,Lovely private bedroom in SF,https://www.airbnb.com/rooms/8597092
37.74847017,-122.417238,Mission District Garden Cottage,https://www.airbnb.com/rooms/1060442
37.75597989,-122.4152521,Sunny Room in Beautiful Victorian,https://www.airbnb.com/rooms/6913294
37.77037944,-122.4222524,Urban Edwardian in the Heart of SF,https://www.airbnb.com/rooms/9776134
37.76725835,-122.4223948,Designer's Nest in the Mission,https://www.airbnb.com/rooms/12266463
37.76006538,-122.4186564,"BRAND NEW, bright and charming, Mission 1BD",https://www.airbnb.com/rooms/17574877
37.75454377,-122.4111001,Tropical Oasis Home with Garden & Parking,https://www.airbnb.com/rooms/1928125
37.75469124,-122.4226532,Mission Victorian for Super Bowl,https://www.airbnb.com/rooms/9726878
37.75239589,-122.4129407,Private Room in the Mission District!,https://www.airbnb.com/rooms/2304925
37.7674576,-122.4232362,"Modern, bright, sexy Mission flat",https://www.airbnb.com/rooms/212297
37.75796429,-122.4197255,Contemporary Mission Victorian,https://www.airbnb.com/rooms/11069241
37.75495392,-122.4168309,Valencia Corridor Center Of It All!,https://www.airbnb.com/rooms/748256
37.76400671,-122.4175282,Beautiful Mission Apt. w/ Roofdeck,https://www.airbnb.com/rooms/8088394
37.74991628,-122.4082173,"Stunning Room in Mission Oasis, Walkers' Paradise",https://www.airbnb.com/rooms/2557977
37.75243517,-122.4152028,Mission bedroom close to BART,https://www.airbnb.com/rooms/3985721
37.75219564,-122.4170061,[10min Moscone] Cozy Room with sunny deck,https://www.airbnb.com/rooms/13249335
37.75465229,-122.4101758,Cozy Cottage With Fire Pit In The Mission,https://www.airbnb.com/rooms/17791068
37.75767012,-122.4174079,Charming Victorian in the Mission,https://www.airbnb.com/rooms/16673580
37.75742313,-122.4236494,Sunny Sweet Mission Dolores Apartment,https://www.airbnb.com/rooms/4500244
37.76374505,-122.4124976,Marie's sunny spacious Mission loft,https://www.airbnb.com/rooms/715543
37.75750508,-122.4235015,Two queen beds apartment,https://www.airbnb.com/rooms/4926230
37.76173049,-122.4256579,2 BR Eclectic Mission Loft,https://www.airbnb.com/rooms/12905241
37.75522798,-122.4179171,North Bernal /Mission Room for all,https://www.airbnb.com/rooms/16117102
37.75886312,-122.423116,SF gorgeous top flat mission area,https://www.airbnb.com/rooms/4295657
37.75631937,-122.404779,Beautiful luxury house w/ Deck,https://www.airbnb.com/rooms/224579
37.74852106,-122.4212581,Spacious studio available,https://www.airbnb.com/rooms/3042598
37.75574133,-122.4115589,Lovely 2 bdrm in the Misson,https://www.airbnb.com/rooms/9465129
37.76012321,-122.4250197,Single bedroom in Dolores Park flat,https://www.airbnb.com/rooms/7351575
37.75300435,-122.403943,CLOUD 9: Bright-Modern-Super Clean :),https://www.airbnb.com/rooms/6600081
37.75298744,-122.4242477,Pre-war Studio Apartment,https://www.airbnb.com/rooms/7679171
37.77002888,-122.4237134,2-Level Modern Apt Comfort in SOMA,https://www.airbnb.com/rooms/4730033
37.75112586,-122.4230647,"24th Mission District, quiet, new remodel",https://www.airbnb.com/rooms/13282475
37.75498191,-122.4193609,Private bedroom in the Mission,https://www.airbnb.com/rooms/9350318
37.75992683,-122.408211,Mission gem,https://www.airbnb.com/rooms/10496718
37.74905921,-122.4182666,Modern 4 Bed House in Sunny Mission,https://www.airbnb.com/rooms/9759420
37.7690889,-122.4239827,Cozy Victorian with fun roommates,https://www.airbnb.com/rooms/14756524
37.75695181,-122.4116516,Chic Mission Victorian 2 BR Flat,https://www.airbnb.com/rooms/6466197
37.75300727,-122.4040496,Modern Private Lair: Trendy Mission,https://www.airbnb.com/rooms/4614763
37.75646678,-122.4164391,Modern 3 br smart home in the heart of the Mission,https://www.airbnb.com/rooms/15346313
37.75349384,-122.4195855,Designer Mission 3 BDRM Victorian,https://www.airbnb.com/rooms/8670481
37.75317766,-122.4244942,Bunk near Dolores Park Mission Noe BART and more!,https://www.airbnb.com/rooms/15424616
37.76052871,-122.4090437,Modern Mission Apt in the BEST Area,https://www.airbnb.com/rooms/10136162
37.76108383,-122.425571,Spacious room in Dolores Park flat,https://www.airbnb.com/rooms/7350876
37.76848691,-122.4206638,Mission Oasis Private Room,https://www.airbnb.com/rooms/4155983
37.74981207,-122.4150952,~Spacious Single Room close to BART in Mission~,https://www.airbnb.com/rooms/17682872
37.75769932,-122.4200553,21st Street,https://www.airbnb.com/rooms/10365512
37.75781911,-122.4108124,Luxury 1br loft   - 1400ftŒ_ ,https://www.airbnb.com/rooms/2665028
37.75603488,-122.4112037,Off-site Meeting Space- Great Views of Sutro Tower,https://www.airbnb.com/rooms/16083525
37.76673598,-122.4240911,Sunny Mission District Apartment,https://www.airbnb.com/rooms/6924852
37.74947188,-122.4185612,New: Modern with patio &projector,https://www.airbnb.com/rooms/10807858
37.74923178,-122.4190466,Awesome n cute  Bernal/ Mission rm  1 or 2 people,https://www.airbnb.com/rooms/3376895
37.76117256,-122.4190939,1 bdr home in Mission District! :),https://www.airbnb.com/rooms/7481897
37.7572341,-122.4150385,Mission Retreat: Architect Re-done Victorian Home,https://www.airbnb.com/rooms/14948841
37.76873486,-122.4245731,Bright and Comfortable Mission Private Room,https://www.airbnb.com/rooms/17590812
37.76952227,-122.4228934,Kid-Friendly Amazing Location ,https://www.airbnb.com/rooms/3385880
37.75123663,-122.4104629,Beautiful Modern Home in SF Mission,https://www.airbnb.com/rooms/7596529
37.75862868,-122.4117893,Sunny Master suite with Garden View,https://www.airbnb.com/rooms/1223107
37.76485673,-122.4251007,WOW STREET-ART INSPIRED 2BED APT W/ GARAGE PARKING,https://www.airbnb.com/rooms/5007820
37.74961855,-122.4209382,In the heart of the Mission,https://www.airbnb.com/rooms/6433637
37.76867917,-122.4225395,"Modern, Sunny Apt in the Mission",https://www.airbnb.com/rooms/9857891
37.76740115,-122.4224661,Sunny bedroom with private bathroom,https://www.airbnb.com/rooms/10660277
37.75186531,-122.4194602,Mission Apartment with Views,https://www.airbnb.com/rooms/14969237
37.76097556,-122.4215808,Secret Mission Garden,https://www.airbnb.com/rooms/27028
37.7615163,-122.4082127,Sunny Oasis in the Mission!,https://www.airbnb.com/rooms/8595828
37.76215982,-122.420623,One bedroom on Valencia St.,https://www.airbnb.com/rooms/10513695
37.75040546,-122.4110787,Spacious Mission Victorian with 3br/ 2ba,https://www.airbnb.com/rooms/16352294
37.75783386,-122.4130874,Bunk bed in the Treat Street Clubhouse,https://www.airbnb.com/rooms/5253439
37.75908236,-122.418195,Downtown VIEWS / 20th Valencia,https://www.airbnb.com/rooms/3434710
37.75958899,-122.4218546,Brand New Trendy Apt In The Mission,https://www.airbnb.com/rooms/8481021
37.7532297,-122.4248993,Calming oasis with views - NEW!,https://www.airbnb.com/rooms/9906403
37.75121152,-122.4077631,Modern master bedroom & garden deck,https://www.airbnb.com/rooms/1468637
37.76277859,-122.4240051,"Mission Dolores - Big Private Room, Best Location",https://www.airbnb.com/rooms/14698527
37.7501035,-122.414981,"Large, beautiful room in the Mission",https://www.airbnb.com/rooms/14185529
37.75136488,-122.4089685,Everest House,https://www.airbnb.com/rooms/11528376
37.76070044,-122.4076222,Inner Mission Apartment with Garage Parking,https://www.airbnb.com/rooms/15509687
37.75374293,-122.4034303,Huge Private Bedroom in the Mission,https://www.airbnb.com/rooms/4436956
37.76443752,-122.4074289,Elegant courtyard professional loft,https://www.airbnb.com/rooms/9201794
37.76724432,-122.4212892,Centrally Located Mission Room,https://www.airbnb.com/rooms/1863106
37.76151096,-122.4220454,Private Room on Valencia St. Private Bath - Weekly,https://www.airbnb.com/rooms/17526405
37.76490477,-122.4239036,Charming room in the Mission! 2 blocks from BART!,https://www.airbnb.com/rooms/16601533
37.75023463,-122.4149721,Spacious room in Mission District,https://www.airbnb.com/rooms/9345890
37.75874295,-122.413272,äÖ_ Victorian Suite in Inner Mission,https://www.airbnb.com/rooms/10251
37.7615991,-122.4216489,Amazing Mission Apt for Super Bowl,https://www.airbnb.com/rooms/10889290
37.76539394,-122.4183993,"Sunny, Airy + Creative Bedroom in the Mission!",https://www.airbnb.com/rooms/14673975
37.77142456,-122.4234505,Classy & Comfy Apt in the ä»«¥Ÿ_ of SF!,https://www.airbnb.com/rooms/7546927
37.75967033,-122.4147865,"Unique Artistic Victorian, Mission",https://www.airbnb.com/rooms/10070039
37.76207429,-122.4063294,Modern urban oasis with 360 city views,https://www.airbnb.com/rooms/15853561
37.75756728,-122.4193947,Bohemian Rhapsody in the Mission,https://www.airbnb.com/rooms/187730
37.76847404,-122.4251584,Sunny Private Room In Top Floor Edwardian,https://www.airbnb.com/rooms/17590102
37.75975848,-122.4071105,Spacious Three bedroom w/ formal dining/LR/Kitchen,https://www.airbnb.com/rooms/9119573
37.75986511,-122.41754,Private Victorian,https://www.airbnb.com/rooms/17329609
37.75862522,-122.4196387,Cute Victorian Home,https://www.airbnb.com/rooms/17464690
37.77109003,-122.4240191,Quiet Victorian near Market Street,https://www.airbnb.com/rooms/829185
37.75708418,-122.4080119,"Victorian top floor flat, Mission",https://www.airbnb.com/rooms/943851
37.7615023,-122.4211684,2bd Beautiful Updated Gem in Mission Dolores,https://www.airbnb.com/rooms/14125801
37.76456493,-122.4138323,Private 1BR in Mission Victorian,https://www.airbnb.com/rooms/2188976
37.76317552,-122.4070776,PRIVATE SUNNY LOVELY BEDROOM/BATH,https://www.airbnb.com/rooms/420160
37.75570083,-122.4232314,Gorgeous SF condo with views,https://www.airbnb.com/rooms/7956829
37.7487178,-122.4199096,Mission Apartment  near Valencia,https://www.airbnb.com/rooms/1370425
37.75608406,-122.4225961,Cozy room in Best Mission Location!,https://www.airbnb.com/rooms/2255169
37.76174179,-122.4175331,Large Sunny 1 Bed in the Mission,https://www.airbnb.com/rooms/9578797
37.75523738,-122.4219086,Charming 2 bdrm Dolores Heights Apt,https://www.airbnb.com/rooms/3238142
37.76239584,-122.4065616,Guest Room - Javier Azul,https://www.airbnb.com/rooms/3268637
37.75813893,-122.4143756,Room in Mission Victorian Mansion,https://www.airbnb.com/rooms/7904207
37.75753408,-122.410455,Great Space and Neighborhood,https://www.airbnb.com/rooms/15771352
37.7666713,-122.4239593,Huge house in Mission 2 blks BART,https://www.airbnb.com/rooms/5482173
37.76602128,-122.4165001,Large 1BR in Mission Victorian,https://www.airbnb.com/rooms/2188919
37.75503446,-122.4190692,Sunny Mission Apt w/ Public Transit,https://www.airbnb.com/rooms/6973090
37.7623101,-122.4197122,Quiet flat in fun neighborhood -- Room 2,https://www.airbnb.com/rooms/15296054
37.74946151,-122.4091694,"Quiet, sunny 2BR Mission home & private garden",https://www.airbnb.com/rooms/501057
37.76299792,-122.4217049,Big Bright Mission-Dolores Flat,https://www.airbnb.com/rooms/3073304
37.75249635,-122.4099389,Private Bedroom- Mission District,https://www.airbnb.com/rooms/2601183
37.76450813,-122.4164842,Cute Central Room and Private Bath,https://www.airbnb.com/rooms/7955738
37.75420874,-122.4177143,House in Heart of the Mission,https://www.airbnb.com/rooms/7256961
37.76720776,-122.4171204,San Francisco Mission-July 1 - 14-Entire Apartment,https://www.airbnb.com/rooms/7873804
37.75171999,-122.4138625,Heart of The Mission - large 3 BR,https://www.airbnb.com/rooms/8742154
37.75559219,-122.4227863,Wonderful Mission Dolores Flat,https://www.airbnb.com/rooms/2319598
37.75228981,-122.4159339,Top Floor of Historic Building,https://www.airbnb.com/rooms/3105998
37.76028596,-122.4234149,Quiet Top Floor Apt in Mission,https://www.airbnb.com/rooms/7578824
37.76649136,-122.4065846,Lovely room/bath in prime location,https://www.airbnb.com/rooms/7565515
37.7656085,-122.4200594,Spacious Sunny Flat in Fun Mission,https://www.airbnb.com/rooms/5007321
37.75135009,-122.4235024,Calming oasis with views - NEW!,https://www.airbnb.com/rooms/9480122
37.75315747,-122.4051128,Large Victorian Home in Mission,https://www.airbnb.com/rooms/6924208
37.75043561,-122.413185,Huge Garden Flat - Heart of Mission,https://www.airbnb.com/rooms/7940010
37.76635223,-122.4211437,Modern & Spacious Mission 1BR Apt.,https://www.airbnb.com/rooms/9242110
37.75658265,-122.4169822,"Lovely 2FL Victorian; deck, garden",https://www.airbnb.com/rooms/386966
37.76766368,-122.424679,Spacious Private Room in the Mission,https://www.airbnb.com/rooms/17639292
37.75701828,-122.4212952,Lovely garden studio off Valencia ,https://www.airbnb.com/rooms/625935
37.75924925,-122.4230581,Lovely Edwardian in Mission Dolores,https://www.airbnb.com/rooms/802839
