latitude,longitude,name,listing_url
37.80238793,-122.4100413,Shared room at Nest Work&Live bed of Branson,https://www.airbnb.com/rooms/15194320
37.79963389,-122.4062527,Beautiful North Beach with views! ,https://www.airbnb.com/rooms/3905190
37.79967276,-122.4055669,Charming North Beach Little Haven,https://www.airbnb.com/rooms/1693257
37.80393648,-122.4060252,Beautiful Telegraph Hill View House,https://www.airbnb.com/rooms/284934
37.80776679,-122.4167065,Sunny Loft @ the Wharf!,https://www.airbnb.com/rooms/7116305
37.80430678,-122.4123408,Airbed/Couch to Crash in North Beach,https://www.airbnb.com/rooms/7181819
37.7992574,-122.4047635,Dorm Beds @ Social SF Hostel #11,https://www.airbnb.com/rooms/7067087
37.80196535,-122.4077696,Experience a North Beach Gem,https://www.airbnb.com/rooms/10825140
37.80860057,-122.41447,Penthouse with 2 Bedrooms @ Fishermans Wharf,https://www.airbnb.com/rooms/6188428
37.80738324,-122.4094443,Motor Yacht - Grand Banks 42 ,https://www.airbnb.com/rooms/3182798
37.80167922,-122.4052656,2 Bedroom Apt In Northbeach,https://www.airbnb.com/rooms/10961121
37.80301726,-122.4102498,Heart of North Beach - Views!,https://www.airbnb.com/rooms/8524982
37.79838697,-122.4048311,Master bedroom in a stunning upscale 2BR condo,https://www.airbnb.com/rooms/17981691
37.80269686,-122.4106114,2 Flr View Penthouse Telegraph Hill,https://www.airbnb.com/rooms/180212
37.80884749,-122.4149903,In the heart of Fisherman's Wharf - 2 Queen Beds,https://www.airbnb.com/rooms/17434782
37.79856345,-122.4042868,"Sunny 1 BR/1BA, Convient Location Near Waterfront",https://www.airbnb.com/rooms/9504910
37.79897822,-122.4061962,Private Bunk Bed Room @SF Hostel #2,https://www.airbnb.com/rooms/4887587
37.80572353,-122.4079979,"Central, Comfortable, Gorgeous View",https://www.airbnb.com/rooms/8652929
37.80722537,-122.4162012,Park View Loft @ the Wharf!,https://www.airbnb.com/rooms/7115664
37.80084662,-122.4108357,Beautiful Redwood Bedroom- Perfect Location in SF,https://www.airbnb.com/rooms/17417018
37.8003938,-122.4066899,2 Bed Rm & 2 Bath Condo w/ Bay VIew,https://www.airbnb.com/rooms/643918
37.79900162,-122.4040308,B... Broadway .Financial .Chinatown,https://www.airbnb.com/rooms/9150693
37.7993326,-122.4062857,Dorm Beds @ Social SF Hostel #8,https://www.airbnb.com/rooms/4902365
37.80288829,-122.4110802,2 Bedroom Penthouse in North Beach,https://www.airbnb.com/rooms/4182201
37.80228263,-122.4060615,Spectacular Tel Hi 3br Penthouse,https://www.airbnb.com/rooms/957584
37.79878042,-122.4035596,1912 Victorian With Epic Views Perched On Gardens,https://www.airbnb.com/rooms/12176844
37.80486405,-122.4079658,Nob Hill Studio,https://www.airbnb.com/rooms/14893922
37.80303257,-122.4099049,Stunning House on Telegraph Hill,https://www.airbnb.com/rooms/1082423
37.80227952,-122.4069805,Bright private bedroom and bath on Telegraph Hill,https://www.airbnb.com/rooms/15068542
37.80285964,-122.4112536,North Beach Lombard Apartment,https://www.airbnb.com/rooms/7914478
37.80516467,-122.4086683,Charming with Incredible View,https://www.airbnb.com/rooms/10105584
37.79954216,-122.4067874,North Beach Best Location and View,https://www.airbnb.com/rooms/308885
37.80535779,-122.4091008,SF Apt w/ bay views & rooftop patio,https://www.airbnb.com/rooms/14534529
37.80157817,-122.410159,COZY in the heart of North Beach,https://www.airbnb.com/rooms/15157053
37.80725258,-122.4194579,Spacious/Sunny Bedrooms - Great Location,https://www.airbnb.com/rooms/17891623
37.80264458,-122.4104635,Luxury View-Home near Fisherman's Wharf,https://www.airbnb.com/rooms/657121
37.80143941,-122.4071775,Lovely apartment in North Beach,https://www.airbnb.com/rooms/10988358
37.80483817,-122.4088777,"Epic North Beach Loft, room for 6",https://www.airbnb.com/rooms/5751316
37.80145896,-122.4038798,Amazing Views - Priv Room,https://www.airbnb.com/rooms/1574848
37.79896902,-122.40582,Magnificent San Francisco Studio w/ Rooftop Deck,https://www.airbnb.com/rooms/17924331
37.80535797,-122.4082354,4 BR house w/ patio & pool table,https://www.airbnb.com/rooms/10827305
37.80416052,-122.4120675,Charming room with AWESOME view!,https://www.airbnb.com/rooms/794815
37.80001323,-122.4045427,SF Telegraph Hill House,https://www.airbnb.com/rooms/6586433
37.79888529,-122.4060525,Sunny 1BR / Overviewing SF and Golden Gate,https://www.airbnb.com/rooms/15941682
37.80271397,-122.4129187,Amazing Location with Fab Bay Views,https://www.airbnb.com/rooms/1589361
37.80209539,-122.4102026,"Heart of North Beach, Walk Everywhere",https://www.airbnb.com/rooms/4526415
37.80227702,-122.4069061,Private Telegraph Hill Oasis Home,https://www.airbnb.com/rooms/11190379
37.81030633,-122.476422,New private Studio w/Garden views.,https://www.airbnb.com/rooms/3093543
37.78987079,-122.4690077,Amazing suite in designer home.,https://www.airbnb.com/rooms/1411264
37.79347438,-122.4479371,Entire SF home for Summer short term/month rental,https://www.airbnb.com/rooms/15633396
37.79559571,-122.4498702,Rent a Rockstar Tour Bus,https://www.airbnb.com/rooms/1961076
37.80656371,-122.4487621,"A lovely and cosy room on wheels, views on demand",https://www.airbnb.com/rooms/16443050
37.80229056,-122.4587997,Beautiful Home in Presidio,https://www.airbnb.com/rooms/5686550
37.79156675,-122.4178411,The perfect San Francisco location!,https://www.airbnb.com/rooms/10733315
37.79218099,-122.4185609,2BR Available in Nob Hill! Recently Renovated.,https://www.airbnb.com/rooms/10970070
37.79328328,-122.4105391,space,https://www.airbnb.com/rooms/17253212
37.79583665,-122.4104827,Remodeled 1 Bedroom-Great Location,https://www.airbnb.com/rooms/8926150
37.7938304,-122.4182835,A Nob Hill Modern Apartment,https://www.airbnb.com/rooms/11973518
37.79251181,-122.4134364,Sweet place in nob hill,https://www.airbnb.com/rooms/16070178
37.79498971,-122.4176116,"Clean, bright, & perfect location - 1 bedroom",https://www.airbnb.com/rooms/14709616
37.79060297,-122.4136458,Union Square High-Rise with Views!,https://www.airbnb.com/rooms/3830608
37.78901529,-122.4206332,2bd 2 Ba Suite with Kitchenette,https://www.airbnb.com/rooms/700928
37.79119007,-122.420715,Comfy couch in a great location,https://www.airbnb.com/rooms/8598745
37.79423328,-122.4162211,Little Jam Near Union Square,https://www.airbnb.com/rooms/1668180
37.790434,-122.4188951,Sunny Private Room in Nob Hill,https://www.airbnb.com/rooms/3710477
37.79101527,-122.4122448,Remodeled 2bd in Union Square,https://www.airbnb.com/rooms/12972437
37.7942845,-122.413363,Lovely Modern 2 Bedroom-Location!,https://www.airbnb.com/rooms/9433478
37.7914932,-122.4152878,"Chic,Central,Priv.Bath Room",https://www.airbnb.com/rooms/1110346
37.79096862,-122.4196439,The Cat Kingdom - a Nob Hill Gem,https://www.airbnb.com/rooms/717046
37.79568722,-122.4109485,Hidden Gem in Nob Hill,https://www.airbnb.com/rooms/11058546
37.7958851,-122.4114515,Great 1BD w/ Private Roof Deck Œæ,https://www.airbnb.com/rooms/1530745
37.79607459,-122.4120814,VIP Suite,https://www.airbnb.com/rooms/10813172
37.79030266,-122.4127271,Quiet Nob Hill - Union Square SF!,https://www.airbnb.com/rooms/6585994
37.79291263,-122.4154393,Charming Studio in Nob Hill,https://www.airbnb.com/rooms/9201385
37.79126694,-122.4134826,Nob Hill/Downtown 2BD 2BR,https://www.airbnb.com/rooms/10436203
37.79291508,-122.4177573,Modern 1 bedroom in Nob Hill,https://www.airbnb.com/rooms/3522119
37.79124176,-122.4181094,Centrally located Nob Hill bedroom!!,https://www.airbnb.com/rooms/13418070
37.79419657,-122.4186386,Russian/Nob Hill Flat in Perfect Location!,https://www.airbnb.com/rooms/15040002
37.7931553,-122.4175692,1 Bedroom For DreamForce,https://www.airbnb.com/rooms/8322485
37.79402874,-122.4139536,Sunny Furnished Studio on Nobhill with 2 Cats,https://www.airbnb.com/rooms/2441167
37.79272434,-122.4182977,Spacious 1 bedroom in Nob Hill,https://www.airbnb.com/rooms/15493989
37.79232196,-122.4157758,Bright Nob Hill Garden Apartment,https://www.airbnb.com/rooms/2757282
37.79160619,-122.4151212,3BR/2BA next to Grace Cathedral,https://www.airbnb.com/rooms/4881805
37.79018105,-122.4117831,Prime Nob Hill Spot!,https://www.airbnb.com/rooms/1539373
37.79253474,-122.4106125,Stunning Nob Hill Studio,https://www.airbnb.com/rooms/10861735
37.79157499,-122.4167532,Private Room in Nob Hill,https://www.airbnb.com/rooms/13407713
37.79378643,-122.4175436,"Small Room Big Dreams, Licensed Rental",https://www.airbnb.com/rooms/13548606
37.79060051,-122.4090475,2Bd 2Ba with Kitchenette T.S.,https://www.airbnb.com/rooms/3767297
37.79021558,-122.4163233,"Sunny Top Floor Large Flat 5 bed/3 bath, Nob Hill.",https://www.airbnb.com/rooms/16088064
37.79305115,-122.4138553,Beautiful spacious Nob Hill private room,https://www.airbnb.com/rooms/17926654
37.79061631,-122.4153005,Lower Nob Hill/Union Square Apartment Great Local,https://www.airbnb.com/rooms/2112492
37.79533701,-122.4171831,Sunny top of Nob Hill,https://www.airbnb.com/rooms/9491619
37.79417163,-122.4186649,Nob Hill's Homiest Apartment,https://www.airbnb.com/rooms/1971246
37.7926468,-122.41909,Spacious bedroom in the heart of SF,https://www.airbnb.com/rooms/8758432
37.79497418,-122.4159208,New apartment in prime spot!,https://www.airbnb.com/rooms/10615018
37.7925631,-122.4213503,Private Floor 3-Level New Townhome!,https://www.airbnb.com/rooms/6338562
37.79225716,-122.4157657,Stunning Room w/view of San Fran,https://www.airbnb.com/rooms/9389324
37.79489258,-122.4119809,Nob Hill Studio,https://www.airbnb.com/rooms/10566523
37.79574337,-122.4134979,Newly Renovated Nob Hill Apartment,https://www.airbnb.com/rooms/10943035
37.79016366,-122.4192029,"Heart of San Francisco, Double Bed",https://www.airbnb.com/rooms/9095601
37.79353882,-122.4193962,"Charming room in a great location, Licensed Rental",https://www.airbnb.com/rooms/13549311
37.79439703,-122.4186398,Contemporary Home with SF Charm,https://www.airbnb.com/rooms/10729985
37.79385604,-122.4190187,Russian Hill Special @ Hyde at Jackson Streets SF,https://www.airbnb.com/rooms/11757982
37.79569442,-122.417082,A Beauty In Nob Hill San Francisco,https://www.airbnb.com/rooms/6993593
37.79299572,-122.4204346,Modern with Succulents,https://www.airbnb.com/rooms/14786197
37.79582599,-122.4190566,Millennial Hill Special,https://www.airbnb.com/rooms/14774400
37.79077951,-122.4093472,Nob Hill Hideaway 1,https://www.airbnb.com/rooms/5666413
37.79064321,-122.4111284,Studio in the Heart of The City,https://www.airbnb.com/rooms/12159249
37.79508167,-122.4117796,Apartment right in the heart of San Francisco!,https://www.airbnb.com/rooms/17151560
37.79568071,-122.4196633,3BD Classic Nob Hill Apartment,https://www.airbnb.com/rooms/10614319
37.79173507,-122.4174841,Stay in Nob Hill! the heart of SF,https://www.airbnb.com/rooms/15054372
37.79377195,-122.4209936,comfortable one bedroom,https://www.airbnb.com/rooms/15585040
37.79278568,-122.4166186,Charming Nob Hill Apartment,https://www.airbnb.com/rooms/10139068
37.79303939,-122.4222798,spacious 1BR off polk street!,https://www.airbnb.com/rooms/1914295
37.79335999,-122.4154976,Beautiful 2 Bed Remodeled Art Space,https://www.airbnb.com/rooms/8385246
37.79357723,-122.4153578,Nob Hill Master Suite,https://www.airbnb.com/rooms/6545132
37.79171378,-122.4093241,Historic SF Master SuiteA,https://www.airbnb.com/rooms/9464045
37.7906458,-122.4152231,1 Bedroom Apartment  Sunny Bright Perfect Location,https://www.airbnb.com/rooms/9709799
37.79100026,-122.4187022,The city at your doorstep,https://www.airbnb.com/rooms/2356531
37.79550978,-122.4186859,Russian Hill Quiet Room,https://www.airbnb.com/rooms/10930648
37.79392856,-122.4207794,Beautiful large room in Nob Hill,https://www.airbnb.com/rooms/9827641
37.79434654,-122.4170899,Very Big & calm room|Best Location in SF |Nob Hill,https://www.airbnb.com/rooms/13235676
37.79254906,-122.4180591,Apartment Available for Superbowl,https://www.airbnb.com/rooms/10636207
37.79486121,-122.4164057,Master bedroom in nice SF apt,https://www.airbnb.com/rooms/8310729
37.78972932,-122.4125027,Union Square High-Rise with a View!,https://www.airbnb.com/rooms/3821508
37.7945654,-122.417817,1 Bedroom in Nob Hill,https://www.airbnb.com/rooms/8323915
37.79508404,-122.4140434,"Amazing views, private deck",https://www.airbnb.com/rooms/11160394
37.78861551,-122.420984,Weekend in San Francisco,https://www.airbnb.com/rooms/6885816
37.79008683,-122.4194269,Nob Hill Fully-Furnished Studio,https://www.airbnb.com/rooms/10783557
37.79292709,-122.4154896,Cozy Nob Hill Apartment,https://www.airbnb.com/rooms/10948389
37.79262852,-122.4223348,Full Apartment (2 big rooms) in Central SF,https://www.airbnb.com/rooms/15486635
37.79039103,-122.4114633,"Victorian Inn, Nob Hill only avail April 14-20,'17",https://www.airbnb.com/rooms/17331009
37.79059087,-122.4124522,Clean & Modern Nob Hill Studio,https://www.airbnb.com/rooms/11035236
37.79178662,-122.4181474,Stay in the Heart of SF,https://www.airbnb.com/rooms/12210252
37.79514686,-122.4190939,Nob Hill Bungalow,https://www.airbnb.com/rooms/12154878
37.79539047,-122.4154119,"Brand New Luxury Residency near Union Squre, Fi-Di",https://www.airbnb.com/rooms/16888580
37.78962933,-122.4135576,Downtown apt next to Union Square,https://www.airbnb.com/rooms/10931776
37.7919198,-122.417154,Quintessential SF Downtown Studio!,https://www.airbnb.com/rooms/11044547
37.7946607,-122.4156572,Entire studio in Nob Hill!,https://www.airbnb.com/rooms/16369339
37.79666781,-122.4127171,Nob Hill room with a great view,https://www.airbnb.com/rooms/52713
37.79527922,-122.4220242,Quiet Top flr 1BR Russian Hill Flat,https://www.airbnb.com/rooms/607913
37.79482284,-122.4115321,"Luxurious, Modern Bedroom-, Views",https://www.airbnb.com/rooms/12452121
37.79105266,-122.4107541,"Beautiful 1 bed apartment, heart of San Francisco",https://www.airbnb.com/rooms/6989963
37.79062641,-122.4166603,Centric Nob Hill Apartment! 2BR/1BA,https://www.airbnb.com/rooms/10061326
37.79036285,-122.4145048,Best Location Near Union Square,https://www.airbnb.com/rooms/11969257
37.79064928,-122.4182799,Huge Penthouse -Amazing Place !,https://www.airbnb.com/rooms/232492
37.79450699,-122.4133262,Spacious Nob Hill Apartment,https://www.airbnb.com/rooms/12340989
37.78974848,-122.4179423,Private Room next to Polk Street,https://www.airbnb.com/rooms/14053493
37.7926885,-122.4161079,2 Bedroom on top of Nob Hill,https://www.airbnb.com/rooms/3272782
37.79037483,-122.4136863,"Modern, Luxury Condo - Nob Hill",https://www.airbnb.com/rooms/10432527
37.79482685,-122.4162286,Nob Hill 1908 Treasure,https://www.airbnb.com/rooms/17084304
37.79032748,-122.4120852,BEST location in Downtown San Fran!,https://www.airbnb.com/rooms/208714
37.79164888,-122.4177507,"Cool Private Room, Walk Everywhere",https://www.airbnb.com/rooms/5160242
37.79223214,-122.418787,Spacious 2BR apartment in Nob Hill,https://www.airbnb.com/rooms/2139948
37.79207828,-122.4159772,Vintage Studio in Heart of the City,https://www.airbnb.com/rooms/7368176
37.79460906,-122.4121318,Small Room in The Heart of SF,https://www.airbnb.com/rooms/4058557
37.79608541,-122.4167426,Classy Nob Hill Apt with rooftop,https://www.airbnb.com/rooms/8712780
37.79578852,-122.4111361,"Luxurious, Modern Bedroom, Views-",https://www.airbnb.com/rooms/12463547
37.79576823,-122.4114131,1 Bedroom North Beach SF,https://www.airbnb.com/rooms/3354004
37.79495196,-122.412198,Room with a Cable car view,https://www.airbnb.com/rooms/4045632
37.79551651,-122.4106498,Gorgeous & Modern Nob Hill Flat,https://www.airbnb.com/rooms/8612967
37.79307771,-122.4148126,Nob Hill gem with great view,https://www.airbnb.com/rooms/8612964
37.79373559,-122.4190727,Nob Hill Apartment,https://www.airbnb.com/rooms/13513230
37.79379585,-122.4173618,Charming Private Room in Nob Hill,https://www.airbnb.com/rooms/17459003
37.78911841,-122.4218557,Beautiful 1br in prime Polk St!,https://www.airbnb.com/rooms/6155285
37.79685822,-122.4114743,Charming Room with Cable Car Views in Chinatown,https://www.airbnb.com/rooms/13332150
37.79380183,-122.4157068,Cozy three bedroom flat in Nob Hill,https://www.airbnb.com/rooms/16395925
37.79648742,-122.4133696,Charming Russian Hill Apartment,https://www.airbnb.com/rooms/11021928
37.79598956,-122.4170663,Sharp Russian Hill Private Bedroom,https://www.airbnb.com/rooms/6077601
37.79161997,-122.409101,TS 1 bd Apartment w/Full Kitchen,https://www.airbnb.com/rooms/7072674
37.78997099,-122.4110563,Luxury Condo with Sweeping View of Sunset,https://www.airbnb.com/rooms/13884559
37.78922747,-122.4165112,Quiet Studio in the Middle of SF,https://www.airbnb.com/rooms/1502017
37.79315241,-122.4156071,Nice private bedroom in Nob Hill,https://www.airbnb.com/rooms/10041491
37.79192178,-122.4145578,Room in the Center of the City,https://www.airbnb.com/rooms/1764111
37.79259871,-122.4204152,Inspiring Studio in the heart of SF,https://www.airbnb.com/rooms/12249865
37.7954661,-122.4149415,1 Quiet Private Room with Bathroom INSIDE ROOM,https://www.airbnb.com/rooms/14861698
37.79464155,-122.4135633,Gorgeous Nob Hill City Escape,https://www.airbnb.com/rooms/7596794
37.79304942,-122.4185647,Panorama GoldenGate View Nob Hill,https://www.airbnb.com/rooms/11480301
37.7900527,-122.4171992,Great Studio in Nob Hill,https://www.airbnb.com/rooms/7842474
37.78997419,-122.4177281,Comfortable 1 BR - Lower Nob Hill (great location),https://www.airbnb.com/rooms/14281343
37.79341992,-122.4190995,Charming SF one bedroom,https://www.airbnb.com/rooms/13734958
37.79541535,-122.4183395,"Large King Room in Great Location, Licensed Rental",https://www.airbnb.com/rooms/13327441
37.7906335,-122.4199491,Nob Hill room close to everything!,https://www.airbnb.com/rooms/9048008
37.79368787,-122.4191093,"Nob Hill Beauty, views of the GG",https://www.airbnb.com/rooms/9710037
37.79470217,-122.4150067,Spacious flat in Nob Hill,https://www.airbnb.com/rooms/10833655
37.79403223,-122.4136831,3-Br apt. on top of Nob Hill!,https://www.airbnb.com/rooms/5512869
37.79422203,-122.414258,Nob Hill 2 Bedroom Boutique Apt,https://www.airbnb.com/rooms/286231
37.79616579,-122.4123604,Top floor unit-priv. bath & parking,https://www.airbnb.com/rooms/7989636
37.79334641,-122.4176436,"4 Bedroom House in Prime Location, Licensed Rental",https://www.airbnb.com/rooms/13953434
37.79171552,-122.4162022,Private bedroom in SF's safest and central area!,https://www.airbnb.com/rooms/13997869
37.79253686,-122.4166128,Studio Apartment in Nob Hill,https://www.airbnb.com/rooms/17017057
37.79510898,-122.4141286,Private Bedroom on top of Nob Hill!,https://www.airbnb.com/rooms/2677798
37.79294727,-122.4166264,SF Nob Hill Victorian Apt,https://www.airbnb.com/rooms/2140313
37.79237471,-122.4092882,Historic SF Parlor SuiteB,https://www.airbnb.com/rooms/9463936
37.79090103,-122.4103615,"Private Room, Next to Union Square",https://www.airbnb.com/rooms/8595819
37.79493242,-122.4198204,Private Cozy Room in Russian Hill,https://www.airbnb.com/rooms/15523581
37.79034639,-122.4155554,Charming 1 BD located in central SF,https://www.airbnb.com/rooms/4646954
37.79527905,-122.4191356,Spacious 1 BR in the heart of Russian Hill,https://www.airbnb.com/rooms/14297089
37.79535341,-122.4124842,Top of the world with Amazing Views,https://www.airbnb.com/rooms/16557842
37.79255158,-122.4129017,Spectacular Nob Hill Penthouse! ,https://www.airbnb.com/rooms/4401445
37.79113835,-122.4102948,Nob Hill Mini Mansion 4b/4b,https://www.airbnb.com/rooms/231129
37.79458981,-122.4138777,2 Bedroom apartment for Rent,https://www.airbnb.com/rooms/8153369
37.79533033,-122.4131665,"Nob Hill charm, location, and view!",https://www.airbnb.com/rooms/1632521
37.79267721,-122.4153231,Walking Distance to Downtown!,https://www.airbnb.com/rooms/1195173
37.7933838,-122.4127396,Dropped price. $150. night,https://www.airbnb.com/rooms/4679350
37.79577821,-122.4157713,Cozy Nob Hill Apt w/ Amazing Rooftop Views,https://www.airbnb.com/rooms/17000090
37.79121516,-122.4179519,Great Location-Nob Hill Crashpad,https://www.airbnb.com/rooms/1336921
37.79148058,-122.4138615,Amazing Large Central Flat,https://www.airbnb.com/rooms/3761446
37.79430063,-122.4199257,Cozy + Bright Nob Hill 1BR,https://www.airbnb.com/rooms/1713391
37.79281194,-122.4206042,Spacious & modern 3br/2ba with deck,https://www.airbnb.com/rooms/10298652
37.79179412,-122.4128814,Super Bowl Accommodation Nob Hill,https://www.airbnb.com/rooms/9814508
37.79163812,-122.4193453,Russian Hill Family Rental House,https://www.airbnb.com/rooms/747416
37.79212066,-122.4196333,Nob Hill 1BR w private bathroom #6,https://www.airbnb.com/rooms/5039986
37.79165106,-122.4130201,Victorian 1BD in Heart of Nob Hill,https://www.airbnb.com/rooms/13412207
37.78973799,-122.4153228,Eduardian Chic in Historic Nob Hill,https://www.airbnb.com/rooms/4286316
37.79483909,-122.4171901,Comfy Russian Hill Home,https://www.airbnb.com/rooms/7919542
37.79284716,-122.4105176,Glam Nob Hill SF Flat - 3BR/1.5BA,https://www.airbnb.com/rooms/12739738
37.79346402,-122.4209466,"Amazing Location, epic spot!!!",https://www.airbnb.com/rooms/7562345
37.79147977,-122.4147937,Sunny Bedroom-Large Victorian Flat,https://www.airbnb.com/rooms/8758259
37.79578313,-122.4110244,"Large Cozy Bedroom in Nob Hill, SF",https://www.airbnb.com/rooms/6481618
37.79152282,-122.4150756,Nob Hill Apartment,https://www.airbnb.com/rooms/10888115
37.79564579,-122.418714,Welcome to San Francisco Ca,https://www.airbnb.com/rooms/10603148
37.79403696,-122.4208748,Amazing Location on Polk St. (2 bd/1.5bth),https://www.airbnb.com/rooms/14918534
37.79230336,-122.418368,Beautiful bedroom in the heart of Nob Hill,https://www.airbnb.com/rooms/13751291
37.79245574,-122.4190388,Nob Hill Private Room,https://www.airbnb.com/rooms/11555166
37.79343121,-122.4136294,Beautiful One Bedroom in Nob Hill,https://www.airbnb.com/rooms/6088161
37.79533074,-122.4120096,3BR MODERN PENTHOUSE w/BEST VIEWS!,https://www.airbnb.com/rooms/6448545
37.79160071,-122.4190834,Your SF home -LOCATION and more,https://www.airbnb.com/rooms/1484149
37.79097471,-122.4152651,Spacious Nob Hill Townhouse with private roof deck,https://www.airbnb.com/rooms/16333422
37.78963357,-122.4135083,The SWEET Spot - Central Location,https://www.airbnb.com/rooms/12362408
37.79475838,-122.4154441,Quintessential San Francisco w/view,https://www.airbnb.com/rooms/2187942
37.79340195,-122.4164929,The Perfect Nob Hill Room,https://www.airbnb.com/rooms/15085679
37.78923807,-122.4185366,Super Bowl Studio - Nob Hill,https://www.airbnb.com/rooms/10815856
37.79001329,-122.412916,Spacious Quiet SF Downtown Retreat,https://www.airbnb.com/rooms/41609
37.79278556,-122.4182534,Private 1 BDR in the Heart of SF!,https://www.airbnb.com/rooms/6742626
37.79112506,-122.4133603,Amazing view w/ double sleeper,https://www.airbnb.com/rooms/6104684
37.79183524,-122.4190525,"AMAZING, AMAZING LOCATION!",https://www.airbnb.com/rooms/2253836
37.78955089,-122.4139189,Wyndham Canterbury 1 Bedroom Deluxe,https://www.airbnb.com/rooms/8921611
37.79355713,-122.4121973,Modern & Bright Nob Hill Apartment!,https://www.airbnb.com/rooms/6136320
37.79474529,-122.4183062,Spectacular 2br Russian Hill Home,https://www.airbnb.com/rooms/4558259
37.79686976,-122.4138146,Russian Hill condo panoramic views,https://www.airbnb.com/rooms/10789339
37.790403,-122.4196877,Nob Hill Single Bedroom 73 #4,https://www.airbnb.com/rooms/5005798
37.79393146,-122.4147961,Charming Nob Hill Studio,https://www.airbnb.com/rooms/17146255
37.79093909,-122.4196998,Nob Hill large single bedroom #1,https://www.airbnb.com/rooms/5005692
37.79327318,-122.4225681,New beautiful 1BR in Nob Hill ,https://www.airbnb.com/rooms/4629268
37.79212309,-122.4213379,Nob Hill Bedroom 69 #4,https://www.airbnb.com/rooms/11241809
37.79555412,-122.4112104,Cute and spacious bedroom,https://www.airbnb.com/rooms/13847355
37.79152904,-122.4159683,Nob Hill Studio,https://www.airbnb.com/rooms/5840328
37.79656407,-122.4133038,2 bd/2 bath Nob Hill with view!,https://www.airbnb.com/rooms/8986011
37.78964289,-122.419613,COZY Home Close to EVERYTHING,https://www.airbnb.com/rooms/10907541
37.79183141,-122.4103843,Stylish Nob Hill;  Mid Century Modern; Parking,https://www.airbnb.com/rooms/14206695
37.7963364,-122.4159751,Junior 1 Bedroom in Nob Hill,https://www.airbnb.com/rooms/13016330
37.79270238,-122.4224159,Cozy & Cool 1 FS Bed Lower Nob Hill,https://www.airbnb.com/rooms/9133330
37.79002306,-122.4178128,"Double Bed, California Street.",https://www.airbnb.com/rooms/9198086
37.79605416,-122.4140737,Charming Russian Hill Studio,https://www.airbnb.com/rooms/4594699
37.79574751,-122.4175842,Sunny quiet room on top of Russian Hill,https://www.airbnb.com/rooms/17641299
37.79141272,-122.4094235,User Profile Image Studio in thehe,https://www.airbnb.com/rooms/7133073
37.79022964,-122.4193037,Private Hotel/Apartment Room for 4,https://www.airbnb.com/rooms/2430730
37.79476609,-122.4205065,Perfect 1BR 4 Last Minute Travelers,https://www.airbnb.com/rooms/9637712
37.79706916,-122.4105066,NobHill Penthouse-Top View&Location,https://www.airbnb.com/rooms/4037590
37.79046683,-122.4183687,Your SF home -LOCATION and more,https://www.airbnb.com/rooms/5377351
37.7966065,-122.4124866,Room in the heart of SF,https://www.airbnb.com/rooms/4251491
37.79668573,-122.4127462,Modern Nob Hill XL Artist Studio,https://www.airbnb.com/rooms/7921496
37.79122142,-122.4155426,Nob Hill 2BR by Cable Car,https://www.airbnb.com/rooms/2449024
37.79189654,-122.4164641,Private Charming Studio in Nob Hill,https://www.airbnb.com/rooms/7904891
37.79054879,-122.4152817,Private Studio in the Center of Nob Hill,https://www.airbnb.com/rooms/11207956
37.79590277,-122.4181289,Rent Russian Hill ,https://www.airbnb.com/rooms/1007157
37.79265684,-122.4212934,Spacious Condo in the Heart of the City,https://www.airbnb.com/rooms/13851541
